exp_id,amount,d_id,description,date,requested_by,approved_by
1788957,20000,1000,Update server storage and memory,6/1/2025,41376655,41376655
1699769,100000,2000,Social media campaign,12/4/2024,41378877,41378877
2100979,30000,3000,Upgrade to smart standing desks in Legal Dep.,3/4/2025,41655533,41655533
1678495,10000,4000,Christmas teambuilding dinner at Nobu Malibu,12/12/2025,42223311,41378877
1899093,100000,5000,Security budget,9/10/2024,41655533,41378877
1959024,59500,4000,Department teambuilding event Q1,2/2/2025,42223311,41378877
